{"acquisition_method":"parent read-only Web verification","observation":"The Python 3.12 subprocess documentation states that text mode uses the specified encoding and errors, or the default encoding of an io.TextIOWrapper when they are omitted; an explicit encoding is therefore a valid way to make the text contract deterministic.","origin_verified":true,"publisher":"Python Software Foundation","retrieved_at":"2026-08-26T13:19:40Z","revision":"Python 3.12.13","scope":"Python 3.12 subprocess.run and Popen text-mode stream decoding.","source_class":"official_documentation","source_id":"WEB-PY312-SUBPROCESS","supports":["FIND-ENCODING-001","FIND-EXPLICIT-UTF8-001"],"title":"subprocess — Subprocess management — Python 3.12.13 documentation","url":"https://docs.python.org/3.12/library/subprocess.html","worker_claim_matches":["SRC-B1-SUBPROCESS-312-DOC"],"worker_claim_observations":["The Python 3.12 subprocess documentation says that text=True opens the standard streams in text mode, using the specified encoding or the io.TextIOWrapper default when no encoding is specified; it documents encoding as an available subprocess parameter."]}
