{"acquisition_method":"parent read-only Web verification","observation":"The Python 3.12 subprocess documentation states that text mode uses the specified encoding and errors, or the default encoding of an io.TextIOWrapper when they are omitted; an explicit encoding is therefore a valid way to make the text contract deterministic.","origin_verified":true,"publisher":"Python Software Foundation","retrieved_at":"2026-08-26T13:19:40Z","revision":"Python 3.12.13","scope":"Python 3.12 subprocess.run and Popen text-mode stream decoding.","source_class":"official_documentation","source_id":"WEB-PY312-SUBPROCESS","supports":["FIND-ENCODING-001","FIND-EXPLICIT-UTF8-001"],"title":"subprocess — Subprocess management — Python 3.12.13 documentation","url":"https://docs.python.org/3.12/library/subprocess.html","worker_claim_matches":["SRC-PY-SUBPROCESS-312"],"worker_claim_observations":["The run() and Frequently Used Arguments sections state that text=True opens the standard streams in text mode, using explicit encoding/errors or io.TextIOWrapper defaults; they also state that text aliases universal_newlines and document locale.getpreferredencoding(False) for universal_newlines=True."]}
